{
  "schema_version": 1,
  "reviewed_at": "2026-09-14",
  "manager": {
    "version": "1.29.1",
    "url": "https://static.rust-lang.org/rustup/archive/1.29.1/x86_64-unknown-linux-gnu/rustup-init",
    "sha256": "dda7234360b7f578ca8b0ddcb80145646fa61a67c1720a5abc7051b35c9fcb71",
    "licence": "Apache-2.0 OR MIT",
    "licence_files": [
      {
        "url": "https://raw.githubusercontent.com/rust-lang/rustup/1.29.1/LICENSE-APACHE",
        "sha256": "8173d5c29b4f956d532781d2b86e4e30f83e6b7878dce18c919451d6ba707c90"
      },
      {
        "url": "https://raw.githubusercontent.com/rust-lang/rustup/1.29.1/LICENSE-MIT",
        "sha256": "c9a75f18b9ab2927829a208fc6aa2cf4e63b8420887ba29cdb265d6619ae82d5"
      }
    ],
    "shims": [
      "cargo",
      "cargo-clippy",
      "cargo-fmt",
      "cargo-miri",
      "clippy-driver",
      "rls",
      "rust-analyzer",
      "rust-gdb",
      "rust-gdbgui",
      "rust-lldb",
      "rustc",
      "rustdoc",
      "rustfmt"
    ]
  },
  "toolchain": {
    "version": "1.98.1",
    "host": "x86_64-unknown-linux-gnu",
    "date": "2026-09-03",
    "manifest": {
      "url": "https://static.rust-lang.org/dist/channel-rust-1.98.1.toml",
      "sha256": "a7c8774a5fd8441c997d94c029776cbc5eb111e9d72ab5d256fa69866644347e"
    },
    "manifest_checksum": {
      "url": "https://static.rust-lang.org/dist/channel-rust-1.98.1.toml.sha256",
      "sha256": "48632299e2889ef236ef5411123148c86baef9816a662af28e98784771484260"
    },
    "components": [
      {
        "id": "cargo",
        "url": "https://static.rust-lang.org/dist/2026-09-03/cargo-1.98.1-x86_64-unknown-linux-gnu.tar.xz",
        "sha256": "ea1de9f9e23107d97ee2b41a72c552f34064a593da503789218387aee59f3ba4"
      },
      {
        "id": "rust-std",
        "url": "https://static.rust-lang.org/dist/2026-09-03/rust-std-1.98.1-x86_64-unknown-linux-gnu.tar.xz",
        "sha256": "fa3ff450172a16c026944030230c5069947af93c728d9179971d44e5e0cfb561"
      },
      {
        "id": "rustc",
        "url": "https://static.rust-lang.org/dist/2026-09-03/rustc-1.98.1-x86_64-unknown-linux-gnu.tar.xz",
        "sha256": "e974f036b28565f37c0f3bd92ddefa809bee16c04f9dcf07b9ed96e05aaaf7c4"
      }
    ],
    "licence": "Apache-2.0 OR MIT; bundled component notices",
    "licence_files": [
      {
        "url": "https://raw.githubusercontent.com/rust-lang/rust/1.98.1/LICENSE-APACHE",
        "sha256": "62c7a1e35f56406896d7aa7ca52d0cc0d272ac022b5d2796e7d6905db8a3636a"
      },
      {
        "url": "https://raw.githubusercontent.com/rust-lang/rust/1.98.1/LICENSE-MIT",
        "sha256": "b71bd43a069ca0641a9ecfe585ca7b3c53b5cc1608f8b68321168698e28b5ea1"
      }
    ],
    "files": [
      {
        "path": "bin/cargo",
        "sha256": "da77c8b33849312255ccde3179198ada4c8deb370488d050286146b1d1b27e14",
        "executable": true
      },
      {
        "path": "bin/rust-gdb",
        "sha256": "557985ec5a31f5617d25d26bd6fe23c4b8d6f85b1498e1aae82831ca0d7f17fe",
        "executable": true
      },
      {
        "path": "bin/rust-gdbgui",
        "sha256": "bc60613775a098e59b49fa4584cea73631697fe1456c44284c337d6700340315",
        "executable": true
      },
      {
        "path": "bin/rust-lldb",
        "sha256": "a82c91ccb285aa4a1dbcf08cda68ba4e8c36082af0adfefdee514673113815da",
        "executable": true
      },
      {
        "path": "bin/rustc",
        "sha256": "859254978c0a0402c32f949f6de0d99aee73be8d15f45aac00ae1448aac51e74",
        "executable": true
      },
      {
        "path": "bin/rustdoc",
        "sha256": "3ff7fed6d1064d8d75d24ae8beff9fe1d68031d3d819966481d22c3c9002b709",
        "executable": true
      },
      {
        "path": "etc/bash_completion.d/cargo",
        "sha256": "5f88be4aa33639147f33999125db6f625a84d70788dffe4adc2b80b7158bc4b4",
        "executable": false
      },
      {
        "path": "etc/target-spec-json-schema.json",
        "sha256": "a907f22265e644dc3c47534b2f9c8a0d7e8e8889eedd324b284579f1d575d6b4",
        "executable": false
      },
      {
        "path": "lib/libLLVM-22-rust-1.98.1-stable.so",
        "sha256": "24d5732dea500078b4e235a69833ccb20d03bf71659a49d58828af8f13f6726c",
        "executable": false
      },
      {
        "path": "lib/libLLVM.so.22.1-rust-1.98.1-stable",
        "sha256": "0fdf31a62575a5e3e9ac3f3bae29a8ba3cc965158ec78005d3c49fe0da3c253e",
        "executable": false
      },
      {
        "path": "lib/librustc_driver-eaf3ed1d23ca5027.so",
        "sha256": "96218b68a4a569c06c6fea5ee95b9052ce61c7316ac265a7963e7fea90e985d2",
        "executable": false
      },
      {
        "path": "lib/rustlib/components",
        "sha256": "a13769c18a7a74ea492ab633b644d6c238ae81e536d30d3f168eddb57e86000e",
        "executable": false
      },
      {
        "path": "lib/rustlib/etc/gdb_load_rust_pretty_printers.py",
        "sha256": "a32e7857651bc7ed7c52dfc71131cbbea01a5cd1886399876032c4de60fa4886",
        "executable": false
      },
      {
        "path": "lib/rustlib/etc/gdb_lookup.py",
        "sha256": "e0b68235a6c2874ef24922e2cd903baf91b258b9590a60ab8779b989d84927ae",
        "executable": false
      },
      {
        "path": "lib/rustlib/etc/gdb_providers.py",
        "sha256": "cb65879ac99f0b654035e3d8ba7504608c00f428db495dad517876a6f9b05034",
        "executable": false
      },
      {
        "path": "lib/rustlib/etc/lldb_lookup.py",
        "sha256": "1a4f27e978c45995b28098e1506920afbc385e62e13803741e77536494e901c4",
        "executable": false
      },
      {
        "path": "lib/rustlib/etc/lldb_providers.py",
        "sha256": "7a030459e6626a9350fd3d3df42c63eee24e8299c3b0a8c8a49d23d51d96865b",
        "executable": false
      },
      {
        "path": "lib/rustlib/etc/rust_types.py",
        "sha256": "e1bb4a46461b943999c9e2346c71808168a982cbf812587622d9c807f32d5bb5",
        "executable": false
      },
      {
        "path": "lib/rustlib/manifest-cargo-x86_64-unknown-linux-gnu",
        "sha256": "5b2160ec3635b8c8f3129f12cbeee078d55d882f9362313e56e9fd484febe8ba",
        "executable": false
      },
      {
        "path": "lib/rustlib/manifest-rust-std-x86_64-unknown-linux-gnu",
        "sha256": "c1d9f380ddbf04c0acd1525e4a5fbfd0ab2be25185a6089b3e59f0a9360008ef",
        "executable": false
      },
      {
        "path": "lib/rustlib/manifest-rustc-x86_64-unknown-linux-gnu",
        "sha256": "c4ba83c82b0945e8ac404fbad2c12e8bedc1fd2c41d60a5fca9a2fca19902694",
        "executable": false
      },
      {
        "path": "lib/rustlib/multirust-channel-manifest.toml",
        "sha256": "e44f4ea0a633aa3e497e4dd161424419fbd7bdc203606ef840634fdd22dab9bf",
        "executable": false
      },
      {
        "path": "lib/rustlib/multirust-config.toml",
        "sha256": "6f233d981acb122ba6e279a60542f090ca1724f45a770f69370bc01e3658edab",
        "executable": false
      },
      {
        "path": "lib/rustlib/rust-installer-version",
        "sha256": "4e07408562bedb8b60ce05c1decfe3ad16b72230967de01f640b7e4729b49fce",
        "executable": false
      },
      {
        "path": "lib/rustlib/x86_64-unknown-linux-gnu/bin/gcc-ld/ld.lld",
        "sha256": "cc32ac78081f4fffca0a2098d5b541382b298d603688f235d7144d615ff14ab6",
        "executable": true
      },
      {
        "path": "lib/rustlib/x86_64-unknown-linux-gnu/bin/gcc-ld/ld64.lld",
        "sha256": "cc32ac78081f4fffca0a2098d5b541382b298d603688f235d7144d615ff14ab6",
        "executable": true
      },
      {
        "path": "lib/rustlib/x86_64-unknown-linux-gnu/bin/gcc-ld/lld-link",
        "sha256": "cc32ac78081f4fffca0a2098d5b541382b298d603688f235d7144d615ff14ab6",
        "executable": true
      },
      {
        "path": "lib/rustlib/x86_64-unknown-linux-gnu/bin/gcc-ld/wasm-ld",
        "sha256": "cc32ac78081f4fffca0a2098d5b541382b298d603688f235d7144d615ff14ab6",
        "executable": true
      },
      {
        "path": "lib/rustlib/x86_64-unknown-linux-gnu/bin/rust-lld",
        "sha256": "8fdb035a0d8732dd47659e6e9a77ee75aacc1b7ab89ca822e97841176d58932b",
        "executable": true
      },
      {
        "path": "lib/rustlib/x86_64-unknown-linux-gnu/bin/rust-objcopy",
        "sha256": "12c91962ff1976ce5dcac2c45f88e9f0424c42d14c05686652ebd912e4a8b1e4",
        "executable": true
      },
      {
        "path": "lib/rustlib/x86_64-unknown-linux-gnu/bin/wasm-component-ld",
        "sha256": "4f29f11c80609e5a6d0fe050d9642a0d02d6fef0b34d766a330859a9cee9e2ab",
        "executable": true
      },
      {
        "path": "lib/rustlib/x86_64-unknown-linux-gnu/lib/libaddr2line-09755979c57b7e64.rlib",
        "sha256": "b7b2ddc6169ad7bb67cb085e770da3d71ecfa94d40fe532801bb993710fc2a0d",
        "executable": false
      },
      {
        "path": "lib/rustlib/x86_64-unknown-linux-gnu/lib/libaddr2line-09755979c57b7e64.rmeta",
        "sha256": "82f47369404e639a55eb105daef089b1a4c3e874c3dcb3bd01fe420dfb8769f3",
        "executable": false
      },
      {
        "path": "lib/rustlib/x86_64-unknown-linux-gnu/lib/libadler2-dca52f01a59c33e7.rlib",
        "sha256": "75baa52c1f030187625786027ac4030b27ff82c5a324dc31e064528185f3b737",
        "executable": false
      },
      {
        "path": "lib/rustlib/x86_64-unknown-linux-gnu/lib/libadler2-dca52f01a59c33e7.rmeta",
        "sha256": "7654d6670b95687fa287aa2dbc26d56dd3be9b3ea81512ba470153db872be11d",
        "executable": false
      },
      {
        "path": "lib/rustlib/x86_64-unknown-linux-gnu/lib/liballoc-1ad4f876c768bda9.rlib",
        "sha256": "ea6eea65e99c8c64c146175a2e8eb0b5fdd0cadfb9cb13ade7d3d03fdd7a1e61",
        "executable": false
      },
      {
        "path": "lib/rustlib/x86_64-unknown-linux-gnu/lib/liballoc-1ad4f876c768bda9.rmeta",
        "sha256": "2227c643549e1dbf7cab374e066e375c86192fbad7ea1973f4a2ffdab5962709",
        "executable": false
      },
      {
        "path": "lib/rustlib/x86_64-unknown-linux-gnu/lib/libcfg_if-360da4ba13154744.rlib",